instructions,rejected_answers,accepted_answers
Describe the concept of an AI character designed to mimic a person's writing style.,"An LLM Twin is defined as an artificial intelligence character that learns to write like a specific individual by incorporating their unique style, personality, and voice into a large language model.","What is your LLM Twin? It is an AI character that writes like yourself by incorporating your style, personality and voice into an LLM."
Explain the distinguishing features of a course focused on building a production-ready AI replica.,"This course is distinct because it teaches the complete process of designing, training, and deploying a production-ready AI twin using large language models, vector databases, and established LLMOps practices, moving beyond basic scripts or notebooks.","By finishing the LLM Twin Building Your Production Ready AI Replica free course, you will learn how to design, train, and deploy a production ready LLM twin of yourself powered by LLMs, vector DBs, and LLMOps good practices. Why should you care? No more isolated scripts or Notebooks!"
What abilities related to system development and operational practices will participants gain?,"Participants will acquire the skills to architect and build an entire real-world LLM system, covering everything from data collection to deployment. They will also learn to implement MLOps best practices, including using experiment trackers, model registries, prompt monitoring, and version control.","You will learn how to architect and build a real world LLM system from start to finish from data collection to deployment. You will also learn to leverage MLOps best practices, such as experiment trackers, model registries, prompt monitoring, and versioning."
What is the final outcome participants are expected to achieve?,The ultimate objective for participants is to successfully construct and deploy their own personalized LLM twin.,The end goal? Build and deploy your own LLM twin.
Outline the process involved in gathering and preparing data from online sources for use in a system.,"The data collection process involves a pipeline that crawls digital data from various social media platforms. Subsequently, it cleans and normalizes this data before loading it into a NoSQL database via a sequence of ETL pipelines.","The data collection pipeline crawls your digital data from various social media platforms. It cleans, normalizes and loads the data to a NoSQL DB through a series of ETL pipelines."
Describe the process for handling messages consumed from a queue before loading them into a specialized database.,"Messages obtained from a queue are processed by a streaming pipeline. This pipeline is responsible for cleaning, chunking, and embedding each message before loading the processed data into a vector database in real time.","The feature pipeline consumes messages from a queue through a Bytewax streaming pipeline. It cleans, chunks, and embeds every message and loads it to a vector DB in real time."
"Outline the procedure for creating, refining, and evaluating a machine learning model using specific tools.","A custom instruction dataset is initially created using digital data. An LLM is then fine-tuned employing Unsloth, AWS SageMaker, and Comet ML for experiment tracking. Subsequently, the LLMs are evaluated with Opik, and the superior model is stored in the Hugging Face model registry.","The training pipeline creates a custom instruction dataset based on your digital data. Fine tune an LLM using Unsloth, AWS SageMaker, and Comet ML's experiment tracker. Evaluate the LLMs using Opik and save the best model to the Hugging Face model registry."
"What kind of professionals would benefit from learning about engineering production systems, and what foundational knowledge should they possess?","The material is designed for Machine Learning Engineers (MLE), Data Engineers (DE), Data Scientists (DS), or Software Engineers (SWE) interested in building production-ready LLM and RAG systems using LLMOps best practices. An intermediate level is expected, requiring basic knowledge of Python and Machine Learning (ML).","Audience MLE, DE, DS, or SWE who want to learn to engineer production ready LLM and RAG systems using LLMOps best practices. Prerequisites basic knowledge of Python and ML."
"What learning resources are available for building an end-to-end system, and what is the suggested method for effective learning?","Learning resources include 10 hands-on written lessons and accompanying open-source code available on GitHub. It's recommended to clone and run the code repository while going through the lessons to maximize understanding, although learners can proceed at their own pace.","The course contains 10 hands on written lessons and the open source code you can access on GitHub, showing how to build an end to end LLM system. To get the most out of this course, we encourage you to clone and run the repository while you cover the lessons."
"Is access to the learning materials and code free, and are there potential expenses involved in using them?","Yes, the learning articles and the associated code are provided completely free of charge and will always remain free. However, executing the code involves using cloud-based tools, like AWS with its pay-as-you-go pricing, which could lead to additional costs.","The articles and code are completely free. They will always remain free. But if you plan to run the code while reading it, you must know that we use several cloud tools that might generate additional costs."
What is the estimated cost for executing the fine-tuning and inference processes?,Testing indicates that the cost to execute the fine-tuning and inference pipelines amounts to $15.,"From our tests, it will cost you 15 to run the fine tuning and inference pipelines."
How is the educational content organized?,The content is divided into 12 distinct lessons. Each lesson corresponds directly to a specific Medium article.,The course is split into 12 lessons. Every Medium article will be its lesson
What is the primary goal of the project described?,"The project's main objective is to construct a production-ready AI replica, referred to as an 'LLM Twin'.","In the first lesson, we will present the project you will build during the course your production ready LLM Twin AI replica."
What core topics are introduced in the first module?,"The initial module introduces the LLM Twin project concept and explains the '3 pipeline design', discussing its application to both standard machine learning systems and the specific LLM project.","In the first lesson, we will present the project you will build during the course your production ready LLM Twin AI replica. Afterward, we will explain what the 3 pipeline design is and how it is applied to a standard ML system."
Which specific system design will be examined in depth?,"The system design for the LLM project, known as the LLM twin, will be explored in detail.","Ultimately, we will dig into the LLM project system design."
Define an AI entity designed to replicate an individual's writing characteristics.,"An AI entity designed to mimic a person's writing is known as an LLM Twin. It achieves this by integrating the individual's specific style, personality, and voice into a large language model.","What is your LLM Twin? It is an AI character that writes like yourself by incorporating your style, personality and voice into an LLM."
What knowledge is gained by constructing a complete AI system?,"By building a complete AI system from start to finish, one learns how to architect and construct such a system, covering all stages from initial data collection through to final deployment.",You will learn how to architect and build a real world LLM system from start to finish from data collection to deployment.
List some recommended practices for managing machine learning operations.,"Recommended practices for managing machine learning operations include using tools and techniques like experiment trackers, model registries, prompt monitoring, and version control.","You will also learn to leverage MLOps best practices, such as experiment trackers, model registries, prompt monitoring, and versioning."
Describe the function of a data collection pipeline for handling digital information.,"A data collection pipeline gathers digital data from various sources, like social media platforms. It then processes this data through ETL pipelines to clean, normalize, and load it into a NoSQL database.","The data collection pipeline crawls your digital data from various social media platforms. It cleans, normalizes and loads the data to a NoSQL DB through a series of ETL pipelines."
What is the advantage of learning production-level machine learning skills?,"Learning production machine learning skills allows practitioners to move beyond simple scripts or notebooks and gain the ability to build and deploy comprehensive, end-to-end systems suitable for real-world use.",No more isolated scripts or Notebooks! Learn production ML by building and deploying an end to end production grade LLM system.
"Describe the process for training a machine learning model, including tools used for tuning and evaluation.","A custom instruction dataset is created using digital data. Then, an LLM is fine-tuned utilizing tools such as Unsloth, AWS SageMaker, and Comet ML for tracking experiments. The models are evaluated with Opik, and the superior model is stored in the Hugging Face model registry.","The training pipeline creates a custom instruction dataset based on your digital data. Fine tune an LLM using Unsloth, AWS SageMaker, and Comet ML's experiment tracker. Evaluate the LLMs using Opik and save the best model to the Hugging Face model registry."
Explain the steps involved in deploying and running a fine-tuned machine learning model for inference.,"The process involves loading and quantizing the fine-tuned LLM from a model registry onto the AWS SageMaker REST API. Prompts are improved using RAG techniques. The LLM's performance is monitored with Opik, and it can be connected to a Gradio user interface.",The inference pipeline loads and quantizes the fine tuned LLM from the model registry to the AWS SageMaker REST API. Enhance the prompts using RAG. Monitor the LLM using Opik. Hook the LLM Twin to a Gradio UI.
"What kind of professionals would benefit from learning about production-ready LLM and RAG systems, and what background knowledge is assumed?","Machine Learning Engineers, Data Engineers, Data Scientists, or Software Engineers aiming to learn the engineering of production-ready LLM and RAG systems using best practices are the target audience. Basic knowledge of Python and Machine Learning is expected.","Audience MLE, DE, DS, or SWE who want to learn to engineer production ready LLM and RAG systems using LLMOps best practices. Prerequisites basic knowledge of Python and ML."
What resources are provided for learning how to construct an end-to-end LLM system?,"The learning resources consist of 10 hands-on written lessons and open-source code available on GitHub, which illustrate the construction of an end-to-end LLM system. Additionally, there are 2 bonus lessons focused on enhancing the RAG system. Learners can study at their own pace and are advised to clone and execute the code repository while going through the lessons for maximum benefit.","The course contains 10 hands on written lessons and the open source code you can access on GitHub, showing how to build an end to end LLM system. Also, it includes 2 bonus lessons on how to improve the RAG system. You can read everything at your own pace. To get the most out of this course, we encourage you to clone and run the repository while you cover the lessons."
Are there any expenses involved in utilizing the learning materials or executing the associated code examples?,"The articles and code are offered entirely free of charge and will continue to be free. However, executing the code may lead to additional costs because it uses cloud services like AWS, which employs a pay-as-you-go pricing structure.","The articles and code are completely free. They will always remain free. But if you plan to run the code while reading it, you must know that we use several cloud tools that might generate additional costs. For example, AWS has a pay as you go pricing plan."
What is the anticipated cost associated with executing the fine-tuning and inference processes?,"Based on tests conducted, the projected cost for running both the fine-tuning and inference pipelines is 15.","From our tests, it will cost you 15 to run the fine tuning and inference pipelines."
Which serverless tools will be utilized under their free usage tiers?,"The free versions of serverless tools Qdrant, Comet, and Opik are planned for use.","We will stick to their free version for the other serverless tools, such as Qdrant, Comet, and Opik."
How many distinct lessons comprise the educational material?,The material is structured into a total of 12 lessons.,The course is split into 12 lessons.
What is the main focus of the first lesson?,"The initial lesson introduces the main project, an 'LLM Twin' AI replica, explains the '3 pipeline design' concept in relation to ML systems, and delves into the specific system design for the LLM project, including data collection and microservice architecture.","In the first lesson, we will present the project you will build during the course your production ready LLM Twin AI replica. Afterward, we will explain what the 3 pipeline design is and how it is applied to a standard ML system."
What platform is mentioned for deploying the system components?,The components discussed will be implemented and subsequently deployed using AWS SageMaker.,"In the following lessons, we will examine each component's code and learn how to implement and deploy it to AWS SageMaker."
Describe what an LLM Twin is.,"An LLM Twin is defined as an artificial intelligence character that learns to replicate your writing style, personality, and voice within a large language model.","What is your LLM Twin? It is an AI character that writes like yourself by incorporating your style, personality and voice into an LLM."
What is the ultimate aim upon finishing the LLM Twin course?,The final objective of completing the course is to successfully construct and deploy your own personalized LLM twin.,The end goal? Build and deploy your own LLM twin.
What practical system development skills will be gained?,"You will acquire the skills to architect and construct a complete, real-world LLM system, covering the entire process from initial data gathering through to final deployment.",You will learn how to architect and build a real world LLM system from start to finish from data collection to deployment.
Identify some MLOps best practices that are taught.,"The course teaches how to utilize MLOps best practices, specifically mentioning experiment trackers, model registries, prompt monitoring, and version control.","You will also learn to leverage MLOps best practices, such as experiment trackers, model registries, prompt monitoring, and versioning."
Explain the role of the data collection pipeline within the system architecture.,"The data collection pipeline is designed to gather digital data from various social media sources, process it through cleaning and normalization steps, and finally load it into a NoSQL database via ETL pipelines.","The data collection pipeline crawls your digital data from various social media platforms. It cleans, normalizes and loads the data to a NoSQL DB through a series of ETL pipelines."
Describe the steps a feature pipeline takes after consuming messages from a queue.,"After consuming messages via a Bytewax streaming pipeline, the feature pipeline cleans, chunks, and embeds each message. Finally, it loads the processed data into a vector database in real time.","The feature pipeline consumes messages from a queue through a Bytewax streaming pipeline. It cleans, chunks, and embeds every message and loads it to a vector DB in real time."
What is the process for training and evaluating large language models in the described pipeline?,"The training pipeline first generates a custom instruction dataset using digital data. It then fine-tunes a large language model with tools like Unsloth, AWS SageMaker, and Comet ML for tracking. Evaluation is performed using Opik, and the best resulting model is stored in the Hugging Face model registry.","The training pipeline creates a custom instruction dataset based on your digital data. Fine tune an LLM using Unsloth, AWS SageMaker, and Comet ML's experiment tracker. Evaluate the LLMs using Opik and save the best model to the Hugging Face model registry."
Identify the serverless tools integrated across the different microservices mentioned.,"Four serverless tools are integrated: Comet ML is used as an experiment tracker, Qdrant serves as the vector database, AWS SageMaker provides the machine learning infrastructure, and Opik is utilized for prompt evaluation and monitoring.","Along the 4 microservices, you will learn to integrate 4 serverless tools Comet ML as your experiment tracker Qdrant as your vector DB AWS SageMaker as your ML infrastructure Opik as your prompt evaluation and monitoring tool."
What background knowledge is recommended for individuals undertaking this learning path?,Individuals looking to follow this path should ideally have a basic understanding of both Python programming and Machine Learning concepts.,Prerequisites basic knowledge of Python and ML.
Explain the cost structure associated with the learning resources and executing the provided code.,"The written materials and the source code are provided entirely free and will stay that way. However, executing the code involves using cloud services like AWS, which follow a pay-as-you-go pricing model, potentially leading to usage costs.","The articles and code are completely free. They will always remain free. But if you plan to run the code while reading it, you must know that we use several cloud tools that might generate additional costs."
What is the estimated cost associated with running specific machine learning pipelines?,"Based on testing, the fine-tuning and inference pipelines are expected to cost 15. Free versions will be used for other serverless tools like Qdrant, Comet, and Opik.","From our tests, it will cost you 15 to run the fine tuning and inference pipelines. We will stick to their free version for the other serverless tools, such as Qdrant, Comet, and Opik."
How is the learning material structured and divided?,The material is divided into 12 lessons. Each lesson corresponds to a specific Medium article.,The course is split into 12 lessons. Every Medium article will be its lesson
What topics are covered in the initial learning module?,"The first module introduces the main project (an LLM Twin AI replica), explains the '3 pipeline design' concept in the context of ML systems, and delves into the LLM project's system design.","In the first lesson, we will present the project you will build during the course your production ready LLM Twin AI replica. Afterward, we will explain what the 3 pipeline design is and how it is applied to a standard ML system. Ultimately, we will dig into the LLM project system design."
Describe the architectural design pattern mentioned for structuring systems.,The material discusses a '3 pipeline design' architecture. It explains its application to standard machine learning systems and how it was specifically used for designing LLM microservices and a social media data collection pipeline.,"Afterward, we will explain what the 3 pipeline design is and how it is applied to a standard ML system. We will present all our architectural decisions regarding the design of the data collection pipeline for social media data and how we applied the 3 pipeline architecture to our LLM microservices."
How will the developed components be deployed?,Later lessons will detail the implementation of each component and explain the process for deploying them onto AWS SageMaker.,"In the following lessons, we will examine each component's code and learn how to implement and deploy it to AWS SageMaker."
